{
  "$schema": "https://json-schema.org/draft/2020-12/schema",
  "$id": "https://github.com/arthurportodev/genesis-platform-api/schemas/production/vulnerability-risk-acceptance.v1.schema.json",
  "title": "Genesis vulnerability risk acceptance v1",
  "type": "object",
  "additionalProperties": false,
  "required": [
    "schemaVersion",
    "taskId",
    "decisionId",
    "decisionDate",
    "approver",
    "scope",
    "expiresAt",
    "baseSha",
    "contractVersion",
    "sourceCandidateId",
    "sourceImageConfigId",
    "sourceRuntimeManifest",
    "baseManifestDigest",
    "platform",
    "runtimeSecuritySubjectId",
    "acceptedFindings",
    "adjudicatedFindings",
    "constraints",
    "publicationAuthorized"
  ],
  "properties": {
    "schemaVersion": { "const": "vulnerability-risk-acceptance.v1" },
    "taskId": { "const": "0.8.2" },
    "decisionId": { "type": "string", "minLength": 1 },
    "decisionDate": { "type": "string", "pattern": "^\\d{4}-\\d{2}-\\d{2}$" },
    "approver": { "type": "string", "minLength": 1 },
    "scope": { "enum": ["ci-validation-only", "publication"] },
    "expiresAt": { "$ref": "#/$defs/timestamp" },
    "baseSha": { "$ref": "#/$defs/gitSha" },
    "contractVersion": { "type": "string", "minLength": 1 },
    "sourceCandidateId": { "$ref": "#/$defs/hash" },
    "sourceImageConfigId": { "$ref": "#/$defs/digest" },
    "sourceRuntimeManifest": { "$ref": "#/$defs/digest" },
    "baseManifestDigest": { "$ref": "#/$defs/digest" },
    "platform": { "const": "linux/amd64" },
    "runtimeSecuritySubjectId": { "$ref": "#/$defs/digest" },
    "acceptedFindings": {
      "type": "array",
      "minItems": 1,
      "uniqueItems": true,
      "items": { "$ref": "#/$defs/finding" }
    },
    "adjudicatedFindings": {
      "type": "array",
      "minItems": 1,
      "uniqueItems": true,
      "items": { "$ref": "#/$defs/finding" }
    },
    "constraints": {
      "type": "object",
      "additionalProperties": false,
      "required": [
        "repository",
        "pullRequest",
        "sourceHead",
        "allowedModes",
        "requireNoUnexpectedHighCritical",
        "requireNoIgnoreRules",
        "requireRuntimeSubjectMatch"
      ],
      "properties": {
        "repository": { "const": "arthurportodev/genesis-platform-api" },
        "pullRequest": { "const": 28 },
        "sourceHead": { "$ref": "#/$defs/gitSha" },
        "allowedModes": {
          "type": "array",
          "minItems": 1,
          "uniqueItems": true,
          "items": { "enum": ["ci-validation", "publication"] }
        },
        "requireNoUnexpectedHighCritical": { "const": true },
        "requireNoIgnoreRules": { "const": true },
        "requireRuntimeSubjectMatch": { "const": true }
      }
    },
    "publicationAuthorized": { "type": "boolean" }
  },
  "$defs": {
    "hash": { "type": "string", "pattern": "^[a-f0-9]{64}$" },
    "gitSha": { "type": "string", "pattern": "^[a-f0-9]{40}$" },
    "digest": { "type": "string", "pattern": "^sha256:[a-f0-9]{64}$" },
    "timestamp": {
      "type": "string",
      "pattern": "^\\d{4}-\\d{2}-\\d{2}T\\d{2}:\\d{2}:\\d{2}(?:\\.\\d{3})?(?:Z|[+-]\\d{2}:\\d{2})$"
    },
    "finding": {
      "type": "object",
      "additionalProperties": false,
      "required": [
        "id",
        "cve",
        "scannerSeverity",
        "package",
        "version",
        "packageType",
        "purl",
        "namespace",
        "distro",
        "matchType",
        "fixState",
        "fixedVersions",
        "disposition",
        "reachability",
        "fixAvailableForDebian13"
      ],
      "properties": {
        "id": { "type": "string", "minLength": 1 },
        "cve": { "type": "string", "pattern": "^CVE-\\d{4}-\\d+$" },
        "scannerSeverity": { "enum": ["Critical", "High"] },
        "package": { "const": "libc6" },
        "version": { "const": "2.41-12+deb13u3" },
        "packageType": { "const": "deb" },
        "purl": { "type": "string", "minLength": 1 },
        "namespace": { "const": "debian:distro:debian:13" },
        "distro": { "const": "debian:13" },
        "matchType": { "const": "exact-indirect-match" },
        "fixState": { "const": "wont-fix" },
        "fixedVersions": { "type": "array", "maxItems": 0 },
        "disposition": {
          "enum": ["accepted-risk-temporary", "unreachable-runtime"]
        },
        "reachability": { "enum": ["unlikely", "plausible", "unreachable"] },
        "fixAvailableForDebian13": { "const": false },
        "riskAcceptance": { "enum": ["required", "not-required"] },
        "proofInvariant": { "type": "string", "minLength": 1 }
      }
    }
  }
}
