{
  "schemaVersion": "vulnerability-risk-acceptance.v1",
  "taskId": "0.8.2",
  "decisionId": "0.8.2-f012-risk-renewal-2026-07-31",
  "decisionDate": "2026-07-31",
  "approver": "arthurportodev",
  "scope": "ci-validation-only",
  "expiresAt": "2026-08-29T23:59:59-03:00",
  "baseSha": "aedafa41eff756ce0e66ed559e91e0ae2d610847",
  "contractVersion": "2.0.0",
  "sourceCandidateId": "e4db25dd49e8c6de569cc0718dce97e073f23ebff3278627af5a045a37ea41d9",
  "sourceImageConfigId": "sha256:8aff04139064e6eb00431d1955045e0ec934c39876476aca9aef10e447a3f5ad",
  "sourceRuntimeManifest": "sha256:14de9d6231b9f9a61703d826a311860a0fdce4f2602a2ffcc2ae705d09c27024",
  "baseManifestDigest": "sha256:b1386d556b478c420927eb212236bfb31be9834a4549850a060a6351f7fff514",
  "platform": "linux/amd64",
  "runtimeSecuritySubjectId": "sha256:fd4b480fe6c36d98650606cc6c64ce98c18709911f98fea060705012d535af08",
  "acceptedFindings": [
    {
      "id": "RISK-001",
      "cve": "CVE-2026-5450",
      "scannerSeverity": "Critical",
      "package": "libc6",
      "version": "2.41-12+deb13u3",
      "packageType": "deb",
      "purl": "pkg:deb/debian/libc6@2.41-12%2Bdeb13u3?arch=amd64&distro=debian-13&upstream=glibc",
      "namespace": "debian:distro:debian:13",
      "distro": "debian:13",
      "matchType": "exact-indirect-match",
      "fixState": "wont-fix",
      "fixedVersions": [],
      "disposition": "accepted-risk-temporary",
      "reachability": "unlikely",
      "fixAvailableForDebian13": false,
      "riskAcceptance": "required"
    },
    {
      "id": "RISK-002",
      "cve": "CVE-2026-5928",
      "scannerSeverity": "High",
      "package": "libc6",
      "version": "2.41-12+deb13u3",
      "packageType": "deb",
      "purl": "pkg:deb/debian/libc6@2.41-12%2Bdeb13u3?arch=amd64&distro=debian-13&upstream=glibc",
      "namespace": "debian:distro:debian:13",
      "distro": "debian:13",
      "matchType": "exact-indirect-match",
      "fixState": "wont-fix",
      "fixedVersions": [],
      "disposition": "accepted-risk-temporary",
      "reachability": "plausible",
      "fixAvailableForDebian13": false,
      "riskAcceptance": "required"
    }
  ],
  "adjudicatedFindings": [
    {
      "id": "ADJ-001",
      "cve": "CVE-2026-5435",
      "scannerSeverity": "High",
      "package": "libc6",
      "version": "2.41-12+deb13u3",
      "packageType": "deb",
      "purl": "pkg:deb/debian/libc6@2.41-12%2Bdeb13u3?arch=amd64&distro=debian-13&upstream=glibc",
      "namespace": "debian:distro:debian:13",
      "distro": "debian:13",
      "matchType": "exact-indirect-match",
      "fixState": "wont-fix",
      "fixedVersions": [],
      "disposition": "unreachable-runtime",
      "reachability": "unreachable",
      "fixAvailableForDebian13": false,
      "riskAcceptance": "not-required",
      "proofInvariant": "cve-2026-5435-unreachable-runtime"
    }
  ],
  "constraints": {
    "repository": "arthurportodev/genesis-platform-api",
    "pullRequest": 28,
    "sourceHead": "c8a58f0fddcdc1523a7387cd0329d66246442868",
    "allowedModes": ["ci-validation"],
    "requireNoUnexpectedHighCritical": true,
    "requireNoIgnoreRules": true,
    "requireRuntimeSubjectMatch": true
  },
  "publicationAuthorized": false
}
